{
  "kind": "local-file",
  "uri": "file:///var/lib/msdemo/results/job_2026_04_05_0001/output.json",
  "content_type": "application/json",
  "size_bytes": 2048,
  "checksum_sha256": "f5a5fd42d16a20302798ef6ed309979b43003d2320d9f0e8ea9831a92759fb4b",
  "metadata": {
    "producer": "local-worker-devbox-01",
    "job_id": "job_2026_04_05_0001"
  }
}
